{
  "schemaVersion": 1,
  "candidateId": "v0141-env-r2-barrosan-signature",
  "briefId": "V0138_01_SALTO_2_5D_ENVIRONMENT_STYLE_FRAME",
  "purpose": "Reference-only Salto environment style-lock revision; R2 tests the strongest distinct Barrosan identity while retaining RTS readability.",
  "generator": "Codex built-in image_gen tool; provider not exposed by tool schema",
  "model": "Not exposed by built-in image_gen tool; Codex feature image_generation reported stable true",
  "date": "2026-06-06",
  "source": {
    "type": "generated-reference",
    "promptDocument": "docs/art-prompts/V0138_01_SALTO_2_5D_ENVIRONMENT_STYLE_FRAME.md",
    "candidateImagePath": "artifacts/art-review/v0138/candidates/v0141-env-r2-barrosan-signature.png",
    "notes": "Generated in v0.141 from the v0.138 Salto environment prompt and the v0.141 revision instructions, using v0.140 A as primary visual base, C as tactical layout reference, and B only for restrained atmosphere."
  },
  "licencePosture": {
    "status": "user-controlled-reference",
    "terms": "Reference review only. No runtime, production, packaging, or derivative approval is granted by this metadata.",
    "runtimeUse": "forbidden",
    "notes": "runtimeIntegrationStatus remains forbidden and runtimeIntegrationStatus = forbidden is a hard v0.141 boundary."
  },
  "protectedIpReview": {
    "status": "pending",
    "protectedLookalikeRisk": "unknown",
    "notes": "Human protected-IP and style-lock review is required before any shortlisting or future art-intake decision."
  },
  "visualNotes": [
    "Strong Barrosan rural highland identity with wet granite terraces, timber-and-stone construction, quarry craft, hearth warmth, moss, and worked earth.",
    "Maintains readable lanes, bridge, ford, shrine, ruin, build area, mine, and Ashen lane while reducing the generic dark-fantasy heaviness from Candidate B.",
    "Human review should check whether the Barrosan architecture reads distinct enough without drifting into generic medieval village."
  ],
  "humanStatus": "pending-review",
  "runtimeIntegrationStatus": "forbidden",
  "hash": {
    "algorithm": "sha256",
    "value": "22443e261f40f4228c9fcb346aa2c344e37449af8c35418259482a3e292b6a7f"
  },
  "dimensions": {
    "width": 1672,
    "height": 941,
    "unit": "px"
  },
  "aspect": "16:9 actual 1672x941",
  "revisionLineage": {
    "parentCandidateId": "v0138-env-a-tactical-clarity; v0138-env-c-modern-2_5d-balance; v0138-env-b-barrosan-atmosphere",
    "revision": 1,
    "notes": "v0.141 revision R2: Candidate A primary visual base, Candidate C tactical layout reference, Candidate B restrained atmosphere reference."
  }
}
